{
  "$schema": "https://json-schema.org/draft/2020-12/schema",
  "$id": "https://raw.githubusercontent.com/gotgenes/pi-permission-system/main/schemas/permissions.schema.json",
  "title": "PI Permission System Configuration",
  "description": "Unified config file combining runtime knobs and flat permission policy for pi-permission-system.",
  "markdownDescription": "Unified config file combining runtime knobs and flat permission policy for [pi-permission-system](https://github.com/gotgenes/pi-permission-system).\n\nPlace at `~/.pi/agent/extensions/pi-permission-system/config.json` (global) or `<project>/.pi/extensions/pi-permission-system/config.json` (project).",
  "type": "object",
  "additionalProperties": false,
  "properties": {
    "$schema": {
      "description": "JSON Schema URI for editor autocomplete and validation.",
      "type": "string"
    },
    "debugLog": {
      "description": "Write verbose permission-system diagnostics to the extension logs directory.",
      "markdownDescription": "Write verbose permission-system diagnostics to `logs/pi-permission-system-debug.jsonl` under the extension config directory.",
      "type": "boolean",
      "default": false
    },
    "permissionReviewLog": {
      "description": "Write permission request and decision audit events to the extension logs directory.",
      "markdownDescription": "Write permission request and decision audit events to `logs/pi-permission-system-permission-review.jsonl` under the extension config directory.",
      "type": "boolean",
      "default": true
    },
    "yoloMode": {
      "description": "Auto-approve ask-state permission checks, including subagent approval forwarding.",
      "markdownDescription": "Auto-approve `ask`-state permission checks, including subagent approval forwarding.\n\n⚠️ **Use with caution** — this disables all interactive confirmation prompts.",
      "type": "boolean",
      "default": false
    },
    "permission": {
      "description": "Flat permission policy. Each key is a surface name; values are a PermissionState string (catch-all) or a pattern→action map.",
      "markdownDescription": "Flat permission policy.\n\nEach top-level key is a surface name:\n- `\"*\"` — universal fallback (replaces `defaultPolicy.tools` from the legacy format)\n- Tool names (`read`, `write`, `bash`, `mcp`, `skill`, `external_directory`, etc.)\n\nA **string** value is shorthand for `{ \"*\": action }` (surface-level catch-all).\nAn **object** value maps wildcard patterns to actions — last matching pattern wins.\n\n**Merge order (lowest → highest precedence):** global → project → per-agent frontmatter.",
      "type": "object",
      "propertyNames": {
        "description": "A surface name or the universal fallback key '*'.",
        "type": "string",
        "minLength": 1
      },
      "additionalProperties": {
        "oneOf": [
          {
            "$ref": "#/$defs/permissionState",
            "description": "Catch-all shorthand: equivalent to { \"*\": action }."
          },
          {
            "$ref": "#/$defs/permissionMap",
            "description": "Pattern→action map for this surface."
          }
        ]
      },
      "examples": [
        {
          "*": "ask",
          "read": "allow",
          "write": "deny",
          "bash": {
            "*": "ask",
            "git status": "allow",
            "git diff": "allow",
            "git *": "ask"
          },
          "mcp": { "*": "ask", "mcp_status": "allow", "exa:*": "allow" },
          "skill": { "*": "ask", "librarian": "allow" },
          "external_directory": "ask"
        }
      ]
    }
  },
  "$defs": {
    "permissionState": {
      "description": "A permission decision: allow (permit silently), deny (block with error), or ask (prompt the user for confirmation).",
      "oneOf": [
        {
          "const": "allow",
          "description": "Permit the action silently with no user interaction."
        },
        {
          "const": "deny",
          "description": "Block the action with an error message. The agent is told not to retry."
        },
        {
          "const": "ask",
          "description": "Prompt the user for confirmation via the interactive UI before proceeding."
        }
      ]
    },
    "permissionMap": {
      "description": "A map of wildcard patterns to permission states. Last matching pattern wins.",
      "markdownDescription": "A map of wildcard patterns to permission states.\n\nUse `*` for wildcard matching. When multiple patterns match, the **last matching rule wins** — put broad catch-alls first and specific overrides after them.\n\nPattern keys support home directory expansion:\n- `~/path` or `$HOME/path` — expanded to the OS home directory at match time.\n- `~` or `$HOME` alone — expands to the home directory itself.\n\nThe stored pattern is always shown in logs and approval dialogs as written (e.g. `~/dev/*`).",
      "type": "object",
      "propertyNames": {
        "description": "A non-empty pattern string. Use * for wildcard matching. Prefix with ~/ or $HOME/ for home-relative paths.",
        "type": "string",
        "minLength": 1
      },
      "additionalProperties": {
        "$ref": "#/$defs/permissionState"
      }
    }
  }
}
